{
  "schema_version": "0.3.0",
  "artifact_type": "semantic_analysis",
  "artifact_id": "semantic_demo_001",
  "run_id": "run_demo_001",
  "iteration": 0,
  "producer": "semantic_analyzer",
  "mode": "development",
  "created_at": "2026-10-07T02:00:00Z",
  "status": "completed",
  "input_refs": [],
  "errors": [],
  "runtime_metrics": {
    "duration_ms": 10,
    "llm_calls": 0,
    "input_tokens": 0,
    "output_tokens": 0,
    "peak_memory_mb": 32
  },
  "data": {
    "normalized_requests": [
      {
        "request_id": "request_read_order",
        "endpoint_id": "endpoint_order",
        "method": "GET",
        "path_template": "/api/orders/{order_id}",
        "account_id": "account_user_a",
        "role_id": "role_user",
        "action_meaning": "read_order",
        "resource_ids": [
          "resource_order_b"
        ],
        "parameters": [
          {
            "parameter_id": "parameter_order_id",
            "name": "order_id",
            "location": "path",
            "value_type": "string",
            "is_sensitive": false
          }
        ],
        "basis": "observed",
        "evidence_refs": []
      },
      {
        "request_id": "request_update_order",
        "endpoint_id": "endpoint_order_status",
        "method": "POST",
        "path_template": "/api/orders/{order_id}/status",
        "account_id": "account_user_a",
        "role_id": "role_user",
        "action_meaning": "update_order",
        "resource_ids": [
          "resource_order_b"
        ],
        "parameters": [
          {
            "parameter_id": "parameter_update_order_id",
            "name": "order_id",
            "location": "path",
            "value_type": "string",
            "is_sensitive": false
          }
        ],
        "basis": "observed",
        "evidence_refs": []
      }
    ],
    "nodes": [
      {
        "node_id": "user:account_user_a",
        "node_type": "User",
        "properties": {
          "account_id": "account_user_a",
          "alias": "user_a",
          "role_id": "role_user"
        },
        "basis": "observed",
        "evidence_refs": []
      },
      {
        "node_id": "user:account_user_b",
        "node_type": "User",
        "properties": {
          "account_id": "account_user_b",
          "alias": "user_b",
          "role_id": "role_user"
        },
        "basis": "observed",
        "evidence_refs": []
      },
      {
        "node_id": "role:role_user",
        "node_type": "Role",
        "properties": {
          "name": "User",
          "role_id": "role_user"
        },
        "basis": "observed",
        "evidence_refs": []
      },
      {
        "node_id": "endpoint_order",
        "node_type": "Endpoint",
        "properties": {
          "method": "GET",
          "path_template": "/api/orders/{order_id}"
        },
        "basis": "observed",
        "evidence_refs": []
      },
      {
        "node_id": "resource_order_b",
        "node_type": "Resource",
        "properties": {
          "resource_key": "order",
          "resource_scope": "instance",
          "match_key": {
            "resource_key": "order",
            "identifiers": [
              {
                "key": "external_id",
                "value": "order-b"
              }
            ]
          },
          "resource_type": "order",
          "external_id": "order-b"
        },
        "basis": "inferred",
        "evidence_refs": []
      },
      {
        "node_id": "endpoint_order_status",
        "node_type": "Endpoint",
        "properties": {
          "method": "POST",
          "path_template": "/api/orders/{order_id}/status"
        },
        "basis": "observed",
        "evidence_refs": []
      }
    ],
    "relationships": [
      {
        "relationship_id": "relationship_user_b_owns_order_b",
        "source_id": "user:account_user_b",
        "target_id": "resource_order_b",
        "relation_type": "OWNS",
        "properties": {},
        "basis": "inferred",
        "evidence_refs": []
      }
    ],
    "workflows": [
      {
        "workflow_id": "workflow_order_update",
        "name": "주문 상태 변경",
        "role_ids": [
          "role_user"
        ],
        "steps": [
          {
            "step_id": "step_read_order",
            "order": 0,
            "action": "read_order",
            "request_ids": [
              "request_read_order"
            ]
          },
          {
            "step_id": "step_update_order",
            "order": 1,
            "action": "update_order",
            "request_ids": [
              "request_update_order"
            ]
          }
        ],
        "dependencies": [
          {
            "before_step_id": "step_read_order",
            "after_step_id": "step_update_order",
            "condition": "주문 조회 뒤 상태를 변경한다",
            "basis": "inferred",
            "evidence_refs": []
          }
        ],
        "basis": "inferred",
        "evidence_refs": []
      }
    ],
    "model_info": {
      "model_id": "local-semantic",
      "model_version": "1",
      "prompt_version": "1",
      "temperature": 0,
      "seed": 7
    }
  }
}
